{
  "$schema": "http://json-schema.org/draft-07/schema#",
  "title": "Atomic Chat stable-diffusion.cpp Backends Manifest",
  "description": "Schema for the remote stable-diffusion.cpp (sd-server / sd-cli) prebuilt manifest consumed by Atomic Chat's diffusion installer. Unlike the llama.cpp manifest, every asset carries an explicit `backend` id: upstream asset names embed the CI runner's OS version (macOS-26.6.2, Ubuntu-24.04), so the client must never derive the platform from the file name.",
  "type": "object",
  "required": ["tag_name", "assets"],
  "additionalProperties": false,
  "properties": {
    "$schema": { "type": "string" },
    "updated_at": { "type": "string", "format": "date-time" },
    "upstream_repo": {
      "type": "string",
      "pattern": "^[A-Za-z0-9_.-]+/[A-Za-z0-9_.-]+$",
      "description": "GitHub repository the tag was released from; the fallback CDN when download_base is absent."
    },
    "tag_name": {
      "type": "string",
      "pattern": "^master-[0-9]+-[0-9a-f]{7}(-a[0-9a-f]{7})?$",
      "description": "leejet/stable-diffusion.cpp release tag (e.g. master-849-d04e895). An `-a<rev>` suffix marks a rebuild of that tag by AtomicBot-ai/stable-diffusion.cpp at fork commit <rev> (mirror-sdcpp.yml atomic_rev): installs are matched on this name, so the new name is what moves installed clients onto the rebuild. The client strips it when downloading from upstream_repo instead of download_base."
    },
    "download_base": {
      "type": "string",
      "format": "uri",
      "description": "Base URL the client prepends to '<tag_name>/<asset name>'. Present once .github/workflows/mirror-sdcpp.yml has re-signed and re-hosted the archives; absent means download from the upstream GitHub release."
    },
    "assets": {
      "type": "array",
      "minItems": 1,
      "items": { "$ref": "#/definitions/asset" }
    }
  },
  "definitions": {
    "asset": {
      "type": "object",
      "required": ["backend", "name"],
      "additionalProperties": false,
      "properties": {
        "backend": {
          "type": "string",
          "enum": [
            "macos-arm64",
            "win-cuda12-x64",
            "win-cuda13-x64",
            "win-rocm-7.14-x64",
            "win-vulkan-x64",
            "win-cpu-x64",
            "linux-cuda12-x64",
            "linux-vulkan-x64",
            "linux-rocm-7.14-x64",
            "linux-cpu-x64",
            "linux-cuda13-arm64",
            "linux-cpu-arm64",
            "win-cuda13-arm64",
            "win-cpu-arm64",
            "win-cudart-cu12"
          ],
          "description": "Stable backend id the client selects on; the only field it matches against. Every asset is built by AtomicBot-ai/stable-diffusion.cpp from the upstream tag of the same name; linux-cuda12-x64, win-cuda13-x64 and the *-arm64 ids other than macos-arm64 have no upstream counterpart and carry their CUDA runtime inside."
        },
        "name": { "type": "string" },
        "sha256": { "type": "string", "pattern": "^[0-9a-f]{64}$" },
        "size": { "type": "integer", "minimum": 1 },
        "companion": {
          "type": "boolean",
          "description": "True for the Windows CUDA runtime archive that is unpacked next to the CUDA backend when the host has no CUDA toolkit."
        }
      }
    }
  }
}
