{
  "$schema": "./sdcpp-schema.json",
  "updated_at": "2026-10-22T09:31:19Z",
  "upstream_repo": "AtomicBot-ai/stable-diffusion.cpp",
  "tag_name": "master-987-a77d362-a242efdc",
  "download_base": "https://github.com/AtomicBot-ai/atomic-chat-conf/releases/download",
  "assets": [
    {
      "backend": "linux-cpu-arm64",
      "name": "sd-master-a77d362-bin-Linux-Ubuntu-24.04-aarch64.zip",
      "sha256": "c3be2a5c93793e22a3ffb235400699e434896ae163464dfeda8d467a84d34f02",
      "size": 21774228
    },
    {
      "backend": "linux-cpu-x64",
      "name": "sd-master-a77d362-bin-Linux-Ubuntu-24.04-x86_64.zip",
      "sha256": "ca1a27b6031d07529b0df672dcfb8c6408863638bce8ab461c3f06beee54ad7a",
      "size": 25716653
    },
    {
      "backend": "linux-cuda12-x64",
      "name": "sd-master-a77d362-bin-Linux-Ubuntu-24.04-x86_64-cuda12.zip",
      "sha256": "c81cc2c5465d13d69413d40085ab96a7db07921622c2cb8f133573fc49b26b96",
      "size": 725020131
    },
    {
      "backend": "linux-cuda13-arm64",
      "name": "sd-master-a77d362-bin-Linux-Ubuntu-24.04-aarch64-cuda13.zip",
      "sha256": "5237840a8544cbca5228bb96fce69d623a6aca8afafb66f016e5b99ea58b54a1",
      "size": 607061957
    },
    {
      "backend": "linux-vulkan-x64",
      "name": "sd-master-a77d362-bin-Linux-Ubuntu-24.04-x86_64-vulkan.zip",
      "sha256": "63c1995158ab4477b7cdc2f089ee1c6e9af53fde407f0415715acb0adbe790ad",
      "size": 35863245
    },
    {
      "backend": "macos-arm64",
      "name": "sd-master-a77d362-bin-Darwin-macOS-26.6.2-arm64.zip",
      "sha256": "a4bdfb93fea295b0ccd354ec537f2473c6dea811784022d0363af581a0a30816",
      "size": 37036190
    },
    {
      "backend": "win-cpu-arm64",
      "name": "sd-master-a77d362-bin-win-cpu-arm64.zip",
      "sha256": "6efbc7d3ddc0daaa65e1b63247b0e1a9a0c18c163c823b49af96d72eeed22588",
      "size": 16607472
    },
    {
      "backend": "win-cpu-x64",
      "name": "sd-master-a77d362-bin-win-cpu-x64.zip",
      "sha256": "bb961f5f3f6a0da558e70ca4332cbec90db262638eeb3704add97d499f6d5cc1",
      "size": 18373624
    },
    {
      "backend": "win-cuda12-x64",
      "name": "sd-master-a77d362-bin-win-cuda12-x64.zip",
      "sha256": "1a4350c9cb6c06733b27886cf259f6aa0819a20109886f252b3d1cb22c7989c7",
      "size": 344305305
    },
    {
      "backend": "win-cuda13-arm64",
      "name": "sd-master-a77d362-bin-win-cuda13-arm64.zip",
      "sha256": "15e8a995ad5d93e40921854cf3042f08e7605e8f548b925b35dac779a916dd5a",
      "size": 211550772
    },
    {
      "backend": "win-cuda13-x64",
      "name": "sd-master-a77d362-bin-win-cuda13-x64.zip",
      "sha256": "4eec9394290011d0000560e9faf117b78318a9b15d1cb7f75e090c96d4420e63",
      "size": 536290217
    },
    {
      "backend": "win-cudart-cu12",
      "name": "cudart-sd-bin-win-cu12-x64.zip",
      "sha256": "fe20366827d357c00797eebb58244dddab7fd9a348d70090c3871004c320f38d",
      "size": 563452046,
      "companion": true
    },
    {
      "backend": "win-vulkan-x64",
      "name": "sd-master-a77d362-bin-win-vulkan-x64.zip",
      "sha256": "296489262481d2b3f626fb871c0090e2cde4a112deb172458973ff03c1d8ed2c",
      "size": 30045551
    }
  ]
}
